{
  "$schema": "https://json-schema.org/draft/2020-12/schema",
  "$id": "https://example.invalid/dacn/d0/execution_receipt.schema.json",
  "title": "execution_receipt d0-v1",
  "type": "object",
  "additionalProperties": false,
  "required": [
    "schema_version",
    "run_id",
    "call_id",
    "case_id",
    "tool_id",
    "tool_version",
    "provider",
    "arguments_sha256",
    "target_binding",
    "started_at",
    "finished_at",
    "outcome",
    "cleanup",
    "resources"
  ],
  "properties": {
    "schema_version": {
      "type": "string",
      "minLength": 1,
      "pattern": "^d0-v1$"
    },
    "run_id": {
      "type": "string",
      "minLength": 1,
      "pattern": "^RUN-[A-Za-z0-9_-]{3,100}$"
    },
    "call_id": {
      "type": "string",
      "minLength": 1
    },
    "case_id": {
      "type": "string",
      "minLength": 1
    },
    "tool_id": {
      "type": "string",
      "minLength": 1,
      "pattern": "^[a-z][a-z0-9_.-]{1,80}$"
    },
    "tool_version": {
      "type": "string",
      "minLength": 1
    },
    "provider": {
      "$ref": "provider.schema.json"
    },
    "arguments_sha256": {
      "type": "string",
      "minLength": 1,
      "pattern": "^[a-f0-9]{64}$"
    },
    "target_binding": {
      "type": "object",
      "additionalProperties": false,
      "required": [
        "status",
        "method",
        "observed_ref",
        "verified_at"
      ],
      "properties": {
        "status": {
          "type": "string",
          "minLength": 1,
          "enum": [
            "VERIFIED",
            "REJECTED",
            "UNAVAILABLE"
          ]
        },
        "method": {
          "type": "string",
          "minLength": 1
        },
        "observed_ref": {
          "$ref": "target_ref.schema.json"
        },
        "verified_at": {
          "type": "string",
          "minLength": 1,
          "pattern": "^\\d{4}-\\d{2}-\\d{2}T\\d{2}:\\d{2}:\\d{2}(?:\\.\\d+)?(?:Z|[+-]\\d{2}:\\d{2})$"
        }
      }
    },
    "started_at": {
      "type": "string",
      "minLength": 1,
      "pattern": "^\\d{4}-\\d{2}-\\d{2}T\\d{2}:\\d{2}:\\d{2}(?:\\.\\d+)?(?:Z|[+-]\\d{2}:\\d{2})$"
    },
    "finished_at": {
      "type": "string",
      "minLength": 1,
      "pattern": "^\\d{4}-\\d{2}-\\d{2}T\\d{2}:\\d{2}:\\d{2}(?:\\.\\d+)?(?:Z|[+-]\\d{2}:\\d{2})$"
    },
    "outcome": {
      "type": "string",
      "minLength": 1,
      "enum": [
        "SUCCESS",
        "PARTIAL",
        "FAILED",
        "TIMEOUT",
        "CANCELLED",
        "DENIED"
      ]
    },
    "cleanup": {
      "type": "object",
      "additionalProperties": false,
      "required": [
        "status",
        "remaining_owned_resources"
      ],
      "properties": {
        "status": {
          "type": "string",
          "minLength": 1,
          "enum": [
            "COMPLETE",
            "INCOMPLETE",
            "NOT_REQUIRED"
          ]
        },
        "remaining_owned_resources": {
          "type": "array",
          "items": {
            "type": "string",
            "minLength": 1
          }
        }
      }
    },
    "resources": {
      "type": "object",
      "additionalProperties": false,
      "required": [
        "duration_ms",
        "output_bytes"
      ],
      "properties": {
        "duration_ms": {
          "type": "integer",
          "minimum": 0
        },
        "output_bytes": {
          "type": "integer",
          "minimum": 0
        }
      }
    }
  }
}
