{
  "schema_version": "d0-v1",
  "run_id": "RUN-fixture0001",
  "call_id": "CALL-fixture0001",
  "case_id": "CASE-fixture0001",
  "tool_id": "static.ember_features",
  "tool_version": "0.1.0",
  "provider": {
    "id": "ember_local",
    "version": "0.1.0",
    "adapter": "ember_adapter",
    "runtime": "python"
  },
  "arguments_sha256": "fede87a598dae05e7eeffd1bfd5ec4386a0c5706159d12712a9575863554cdaf",
  "target_binding": {
    "status": "VERIFIED",
    "method": "opened_handle_identity_and_digest",
    "observed_ref": {
      "schema_version": "target-ref-v1",
      "kind": "FILE",
      "observed": {
        "path": "C:\\samples\\fixture.exe"
      },
      "identity_strength": "PARTIAL",
      "verified_digest": {
        "algorithm": "sha256",
        "value": "aaaaaaaaaaaaaaaaaaaaaaaaaaaaaaaaaaaaaaaaaaaaaaaaaaaaaaaaaaaaaaaa"
      },
      "snapshot": {
        "size_bytes": 1024,
        "mtime_ns": 123456789
      },
      "revalidation_required": true
    },
    "verified_at": "2026-10-23T10:00:00Z"
  },
  "started_at": "2026-10-23T10:00:00Z",
  "finished_at": "2026-10-23T10:00:01Z",
  "outcome": "SUCCESS",
  "cleanup": {
    "status": "NOT_REQUIRED",
    "remaining_owned_resources": []
  },
  "resources": {
    "duration_ms": 1000,
    "output_bytes": 128
  }
}
